ステージ6導入ストーリー,,,,,,,,,,,,,,,,,
,発言者,台詞,表情ID,左キャラ,キャラクターID,表情ID,中央キャラ,キャラクターID,表情ID,右キャラ,キャラクターID,小窓画像名,小窓画像ID,表示位置,背景,背景ID,F.I/F.O
1クリック目,沖野ヨーコ,"いよいよこのゲームも後半に突入です！
今回の宝物は、お土産さんに隠れています！",,,,2,沖野ヨーコ,21,,,,,,,デパート,18,IN
2クリック目,沖野ヨーコ,みんな張り切って見つけてね！,,,,,,,,,,,,,,,
3クリック目,毛利小五郎,"ふふふ…正に絶好調〜！
これならヨーコちゃんのち、ち、ち、チューは俺のもの…！",,,,2,毛利小五郎,4,,,,,,,,,
4クリック目,灰田富士夫,"まだまだ！
ヨーコちゃんのチューは渡さないぞ！",1,灰田富士夫,84,,,,,,,,,,,,
5クリック目,東たけし,年間パスはボクのものだーい！,,,,,,,1,東たけし,81,,,,,,
6クリック目,小嶋元太,オレたちも負けてらんねぇぞ！,7,小嶋元太,17,,,,,,,,,,,,
7クリック目,円谷光彦,もちろんですよ！,,,,,,,2,円谷光彦,15,,,,,,
8クリック目,吉田歩美,わたし、負けないもん！,,,,3,吉田歩美,12,,,,,,,,,
