エンディングストーリー,,,,,,,,,,,,,,,,,,,,,,
,発言者,台詞,"表情ID",左キャラ,キャラクターID,"表情ID",中央キャラ,キャラクターID,"表情ID",右キャラ,キャラクターID,小窓画像名,小窓画像ID,"表示位置",背景,背景ID,F.I/F.O,,,,,
1クリック目,勝俣ヒロシ,"この<font color='#FF9D9D'>ソックス</font>は僕のですが……
でもソックスでガラスが割れるわけないじゃないですか！",1,毛利蘭,8,1,勝俣ヒロシ,56,,,,"ソックス",319,右,教室,1,IN,,,,,
2クリック目,毛利蘭,"ソックスに小石を積めれば強力な鈍器になる……
実際、現場にはたくさんの小石が落ちていたわ！",7,毛利蘭,8,,,,,,,,,,,,,,,,,
3クリック目,勝俣ヒロシ,"そうか……もう隠せないみたいですね……
廃屋のガラスを割ったのは僕です…",,,,,,,,,,,,"右：非表示",,,,,,,,
4クリック目,勝俣ヒロシ,"実はあの廃屋にはネコが閉じ込められていて
そのネコを助けるために、ガラスを割ったんです……",,,,,,,,,,,,,,,,,,,,
5クリック目,毛利蘭,"廃屋にネコ？
もしかして、園子の言ってたネコのオバケって……",,,,,,,,,,,,,,,,,,,,
6クリック目,勝俣ヒロシ,"僕が助けたネコだと思います……
どこからか入り込んで、出られなくなったみたいで……",,,,,,,,,,,,,,,,,,,,
7クリック目,毛利蘭,"そのネコの鳴き声が、オバケの噂になったんだ……",,,,,,,,,,,,,,,,,,,,
8クリック目,勝俣ヒロシ,"ガラスを割ったことは悪いと思ってますし…
すべて正直に話します……",,,,,,,,,,,,,,,,,,,,
9クリック目,勝俣ヒロシ,"怒られても平気ですよ……
慰めてくれる新しい家族ができましたからね！",,,,,,,,,,,,,,,,,,,,
